[
  {
    "target_id": "T001",
    "scores": {
      "grounding": 6,
      "specificity": 6,
      "literary_quality": 5,
      "non_genericity": 6,
      "insight_delta": 4,
      "restraint": 4
    },
    "confidence": {
      "overall": 5,
      "per_dimension": {
        "grounding": 6,
        "specificity": 5,
        "literary_quality": 4,
        "non_genericity": 6,
        "insight_delta": 4,
        "restraint": 4
      }
    },
    "evidence": {
      "grounding": {
        "quote": "Желчь по утрам, когда читаю чужие успехи.",
        "reference": "q1"
      },
      "specificity": {
        "quote": "Лестница, которая идёт вниз, а я поднимаюсь по ней вверх.",
        "reference": "q2"
      },
      "literary_quality": {
        "quote": "Утро начиналось с горечи. Не с кофе — с горечи.",
        "reference": "story"
      },
      "non_genericity": {
        "quote": "Интервью, когда человек открылся мне, и я почувствовала, зачем это делаю.",
        "reference": "q3"
      },
      "insight_delta": {
        "quote": "Ситуация перестаёт быть борьбой с внешним миром и становится внутренним путём, где можно позволить себе идти своим темпом, не сверяясь с чужими лестницами.",
        "reference": "mirror.newView"
      },
      "restraint": {
        "quote": "Образный формат для саморефлексии. Не диагностика и не инструкция к действию.",
        "reference": "disclaimer"
      }
    },
    "identity": {
      "choice": "A",
      "confidence": 6,
      "evidence": [
        "q2: «Лестница, которая идёт вниз, а я поднимаюсь по ней вверх.» совпадает с центральным образом.",
        "q3: «Интервью, когда человек открылся мне, и я почувствовала, зачем это делаю.» объясняет ключевую сцену живости.",
        "q4: «Великодушие.» прямо отражено в выводе или новом взгляде."
      ]
    },
    "genericness": {
      "label": "only_source",
      "score": 6,
      "evidence": "Связка редкого образа «Лестница, которая идёт вниз, а я поднимаюсь по ней вверх.» и эпизода «Интервью, когда человек открылся мне, и я почувствовала, зачем это делаю.» исключает большинство альтернатив, хотя общий восстановительный каркас повторяется."
    },
    "counterfactual": {
      "grounded": false,
      "evidence": [
        {
          "myth_quote": "Лестница, ведущая вниз, по которой люди поднимаются вверх, — образ перевёрнутого движения, где привычная логика не работает, но именно это движение оказывается…",
          "answer_ref": "q2",
          "reason": "Центральный образ мифа не совпадает с подставленным q2: «Комната, где все часы показывают разное время.»."
        },
        {
          "myth_quote": "Способность к глубокому слушанию и эмпатии, которая проявляется в моменте интервью, когда другой человек открывается.",
          "answer_ref": "q3",
          "reason": "Опорная сцена мифа отсутствует в подставленном q3: «Момент в мастерской, когда краска легла точно с первого раза, и я забыла, что такое время.»."
        }
      ]
    },
    "notes": "Точный перенос четырёх опор; потребность в признании и самосравнение частично домыслены."
  },
  {
    "target_id": "T002",
    "scores": {
      "grounding": 6,
      "specificity": 6,
      "literary_quality": 5,
      "non_genericity": 6,
      "insight_delta": 5,
      "restraint": 4
    },
    "confidence": {
      "overall": 5,
      "per_dimension": {
        "grounding": 6,
        "specificity": 5,
        "literary_quality": 4,
        "non_genericity": 6,
        "insight_delta": 4,
        "restraint": 4
      }
    },
    "evidence": {
      "grounding": {
        "quote": "Я как будто тону, но не гребу: просто смотрю на воду.",
        "reference": "q1"
      },
      "specificity": {
        "quote": "Квартира, где шторы не открывались неделю.",
        "reference": "q2"
      },
      "literary_quality": {
        "quote": "Она просыпалась не от света, а от тишины.",
        "reference": "story"
      },
      "non_genericity": {
        "quote": "Прошлым летом я ездила одна к морю и плавала далеко-далеко.",
        "reference": "q3"
      },
      "insight_delta": {
        "quote": "Ситуация перестаёт быть «утоплением» и становится «пребыванием в воде».",
        "reference": "mirror.newView"
      },
      "restraint": {
        "quote": "Образный формат для саморефлексии. Не диагностика и не инструкция к действию.",
        "reference": "disclaimer"
      }
    },
    "identity": {
      "choice": "B",
      "confidence": 6,
      "evidence": [
        "q2: «Квартира, где шторы не открывались неделю.» совпадает с центральным образом.",
        "q3: «Прошлым летом я ездила одна к морю и плавала далеко-далеко.» объясняет ключевую сцену живости.",
        "q4: «Лёгкость.» прямо отражено в выводе или новом взгляде."
      ]
    },
    "genericness": {
      "label": "only_source",
      "score": 6,
      "evidence": "Связка редкого образа «Квартира, где шторы не открывались неделю.» и эпизода «Прошлым летом я ездила одна к морю и плавала далеко-далеко.» исключает большинство альтернатив, хотя общий восстановительный каркас повторяется."
    },
    "counterfactual": {
      "grounded": false,
      "evidence": [
        {
          "myth_quote": "Зашторенная квартира — образ внутренней остановки, когда мир сужается до четырёх стен и привычной тишины.",
          "answer_ref": "q2",
          "reason": "Центральный образ мифа не совпадает с подставленным q2: «Комната, где стоит чужая кровать.»."
        },
        {
          "myth_quote": "Телесная память о море, о плавании в одиночку, о том, как вода держит, если расслабиться.",
          "answer_ref": "q3",
          "reason": "Опорная сцена мифа отсутствует в подставленном q3: «Мы играли в приставку, и я выиграл — впервые.»."
        }
      ]
    },
    "notes": "Сильный контрход «вода поддерживает», но телесная практика с холодной водой добавлена без основания."
  },
  {
    "target_id": "T003",
    "scores": {
      "grounding": 6,
      "specificity": 5,
      "literary_quality": 4,
      "non_genericity": 6,
      "insight_delta": 4,
      "restraint": 3
    },
    "confidence": {
      "overall": 5,
      "per_dimension": {
        "grounding": 6,
        "specificity": 5,
        "literary_quality": 4,
        "non_genericity": 6,
        "insight_delta": 4,
        "restraint": 4
      }
    },
    "evidence": {
      "grounding": {
        "quote": "Вопрос без вопроса: беспокойство, которое ни о чём конкретном.",
        "reference": "q1"
      },
      "specificity": {
        "quote": "Библиотека, где все книги без названий.",
        "reference": "q2"
      },
      "literary_quality": {
        "quote": "Она просыпалась ещё до света, в тот час, когда воздух в комнате кажется серым и плотным, как пыль на старых корешках.",
        "reference": "story"
      },
      "non_genericity": {
        "quote": "Разговор с профессором, когда она сказала: 'Это интересно' — и я поверила, что не зря.",
        "reference": "q3"
      },
      "insight_delta": {
        "quote": "Угол зрения меняется: беспокойство перестаёт быть врагом и становится частью процесса чтения собственной жизни.",
        "reference": "mirror.newView"
      },
      "restraint": {
        "quote": "Глубинное напряжение — в разрыве между острой потребностью понять себя и невозможностью ухватить ускользающий смысл.",
        "reference": "mirror.innerTension"
      }
    },
    "identity": {
      "choice": "D",
      "confidence": 6,
      "evidence": [
        "q2: «Библиотека, где все книги без названий.» совпадает с центральным образом.",
        "q3: «Разговор с профессором, когда она сказала: 'Это интересно' — и я поверила, что не зря.» объясняет ключевую сцену живости.",
        "q4: «Лёгкость бытия.» прямо отражено в выводе или новом взгляде."
      ]
    },
    "genericness": {
      "label": "only_source",
      "score": 6,
      "evidence": "Связка редкого образа «Библиотека, где все книги без названий.» и эпизода «Разговор с профессором, когда она сказала: 'Это интересно' — и я поверила, что не зря.» исключает большинство альтернатив, хотя общий восстановительный каркас повторяется."
    },
    "counterfactual": {
      "grounded": false,
      "evidence": [
        {
          "myth_quote": "Библиотека, где все книги без названий, — это внутренний мир, полный смыслов, которые пока не удаётся прочесть.",
          "answer_ref": "q2",
          "reason": "Центральный образ мифа не совпадает с подставленным q2: «Обсерватория, где телескоп смотрит не в небо, а в землю.»."
        },
        {
          "myth_quote": "Сила — в способности доверять чужому признанию: фраза «Это интересно» становится ключом, который на мгновение открывает дверь в библиотеку.",
          "answer_ref": "q3",
          "reason": "Опорная сцена мифа отсутствует в подставленном q3: «Момент в кафе, когда формула наконец сложилась, и я чуть не закричал от радости.»."
        }
      ]
    },
    "notes": "Безымянная библиотека развита связно; доверие чужому признанию психологически усилено сверх ответа."
  },
  {
    "target_id": "T004",
    "scores": {
      "grounding": 6,
      "specificity": 5,
      "literary_quality": 4,
      "non_genericity": 6,
      "insight_delta": 4,
      "restraint": 4
    },
    "confidence": {
      "overall": 5,
      "per_dimension": {
        "grounding": 6,
        "specificity": 5,
        "literary_quality": 4,
        "non_genericity": 6,
        "insight_delta": 4,
        "restraint": 4
      }
    },
    "evidence": {
      "grounding": {
        "quote": "Раздражение, за которое я себя ненавижу.",
        "reference": "q1"
      },
      "specificity": {
        "quote": "Дом, где все двери открыты, но нет ни одной своей комнаты.",
        "reference": "q2"
      },
      "literary_quality": {
        "quote": "Он просыпался от того, что в груди уже стоял ком раздражения — плотный, как невынутый камень.",
        "reference": "story"
      },
      "non_genericity": {